{
  "schema": "iot.canonical-telemetry.v1",
  "organization_uuid": "aaaaaaaa-aaaa-4aaa-8aaa-aaaaaaaaaaaa",
  "gateway_uuid": "30000000-0000-4000-8000-000000000001",
  "gateway_route_uuid": "53000000-0000-4000-8000-000000000001",
  "device_uuid": "50000000-0000-4000-8000-000000000001",
  "parameter_uuid": "51000000-0000-4000-8000-000000000009",
  "profile_version_uuid": "51000000-0000-4000-8000-000000000002",
  "binding_version_uuid": "52000000-0000-4000-8000-000000000002",
  "source": "measured",
  "observed_at": "2026-08-29T18:05:00Z",
  "received_at": "2026-08-29T18:05:00.025Z",
  "value_type": "float64",
  "value": 1534.2,
  "quality": {
    "status": "good",
    "codes": []
  },
  "message_id": "hub-message-0002",
  "runtime_bundle_hash": "bbbbbbbbbbbbbbbbbbbbbbbbbbbbbbbbbbbbbbbbbbbbbbbbbbbbbbbbbbbbbbbb"
}
